video_id,clip_id,text,label,annotation,mode,label_by
cXypl4FnoZo,14,UM I JUST I WOULDVE LIKE ME AND LOUIS WERE SAYING WE WERE THINKING THE WHOLE TIME LIKE WHO COULDVE BE WHO COULDVE BE,-0.6,Negative,test,0
cXypl4FnoZo,17,ITS JUST LIKE THIS THIS CHARACTER WHOS KIND OF RANDOM,-0.6,Negative,test,0
cXypl4FnoZo,16,I DONT KNOW HOW TO LIKE TELL YOU WHO HE IS COZ YOURE GONNA BE LIKE THAT DOESNT NARROW IT DOWN AT ALL,-0.6,Negative,test,0
cXypl4FnoZo,19,UM BUT YEAH WHATEVER UM HE WE THOUGHT IT WOULD BE HIM BECAUSE THEY WERENT SHOWING HIM A LOT BUT THEY SHOWED HIM ENOUGH TO THEY KIND OF BE LIKE OH IT WAS HIM IN THE END,0.8,Positive,test,0
cXypl4FnoZo,18,AND HE I DONT I THINK HE MAYBE HE GOT MAD WHEN HAH I DONT KNOW,-0.25,Negative,test,0
d3_k5Xpfmik,11,THIS CREDIT SEQUENCE I THINK IS THE BEST CREDIT SEQUENCE UM SINCE WATCHMAN,2.4,Positive,test,0
d3_k5Xpfmik,10,UM ITS BASICALLY A UM SLOW MOTION SHOW CASE OF DIFFERENT EVENTS,0.4,Positive,test,0
d3_k5Xpfmik,13,YEAH IT REALLY IS GOOD I MEAN,2.2,Positive,test,0
d3_k5Xpfmik,12,AND I HONESTLY THINK IF WE HADNT HAVE SEEN WATCHMAN THIS WOULD BE THE BEST CREDIT SEQUENCE OF THE YEAR,2.0,Positive,test,0
d3_k5Xpfmik,15,THE SEQUENCES OF THE BEGINNING OF THE FILM WHICH FEATURES COLUMBUS EXZPLAINING SOME OF HIS RULES UM TO SURVIVING A ZOMBIE APOCALIPSE ARE REALLY WELL DONE,2.6,Positive,test,0
d3_k5Xpfmik,14,IT USES UM AND THIS JUST DOESNT APPLY TO THE UM UM CREDIT SE SEQUENCE ON IT OWN BUT APPIES TO THE MOVIE AS A WHOLE IT REALLY KNOWS HOW TO USE S SLOW MOTION WITHOUT MAKING IT A GIMMICK,2.0,Positive,test,0
d3_k5Xpfmik,17,BUT ITS A VERY KIND OF UM STYLISTIC EDGE ON IT,1.6,Positive,test,0
d3_k5Xpfmik,16,THE XXX SEQUENCE IS REALLY WELL DONE,2.0,Positive,test,0
d3_k5Xpfmik,19,AND THE STYLE OF THE FILM LIKE THE UM THE FREE STREAMS OF SLOW MOTION THE UM THE JUMP COOKS AND ALL THAT STUFF FEELS VERY KIND OF UM TARANTINO ASK,0.2,Positive,test,0
d3_k5Xpfmik,18,IT ITS ALMOST LIKE UM IMAGINING TARANTINO DIRECTED A ZOMBIE MOVIE,0.8,Positive,test,0
d3_k5Xpfmik,1,WHO HAVE NAMED THEMSELVES AFTER THE PLACES UM TO WHICH THEY HAVE TRAVELED IN WHICH I THINK IS A REALLY NICE XXX,2.0,Positive,test,0
d3_k5Xpfmik,3,THE UM CROSS OF PERSONALITY IS REALLY UM CHARISMATIC AND DYNAMIC,2.0,Positive,test,0
d3_k5Xpfmik,2,NOW COLUMBOS IS A BASICALLY UM OCD,0.0,Neutral,test,0
d3_k5Xpfmik,5,ZOMBIELAND IS A REALLY SUCESSFUL HORROR COMEDY,2.2,Positive,test,0
d3_k5Xpfmik,4,UM IT JUST GOES TO SHOW THAT YOU REALLY CANT TRUST ANYONE IN THIS SITUATION,-1.0,Negative,test,0
d3_k5Xpfmik,7,AND UM WHILE ALSO MAINTAINS ITS KIND OF DETACHED UM SATIRE OF THE GENRE,0.4,Positive,test,0
d3_k5Xpfmik,6,AS IT CONTAINS UM REA REALLY WELL DONE AND FAITHFUL HOMAGES TO THE ZOMBIE HORROR SUB GANRE,1.6,Positive,test,0
d3_k5Xpfmik,9,BECAUSE UM YOU REALLY WANNA SEE IT FOR YOURSELF,1.4,Positive,test,0
d3_k5Xpfmik,8,BUT ITS REALLY WELL DONE,2.2,Positive,test,0
d6hH302o4v8,42,I DONT KNOW WHY I EVEN SAW IT,-1.4,Negative,test,0
d6hH302o4v8,43,SO SEASON OF THE WITCH IS RATED 3 OUT OF 10,-2.5,Negative,test,0
d6hH302o4v8,24,IT WAS VERY VERY VERY BORING,-2.8,Negative,test,0
d6hH302o4v8,25,MADE NO SENSE,-1.6,Negative,test,0
d6hH302o4v8,26,ACTION SCENSE WERE VERY DUMB,-2.6,Negative,test,0
d6hH302o4v8,27,I HATED IT,-2.6,Negative,test,0
d6hH302o4v8,20,UH THE TRAILER LOOKED LIKE IT COULD BE A LITTLE G GOOD,1.0,Positive,test,0
d6hH302o4v8,21,BUT WHEN I SAW IT WAS JUST TOTALLY BORING,-2.4,Negative,test,0
d6hH302o4v8,22,BUT IT WASNT REALLY MADE WELL,-1.0,Negative,test,0
d6hH302o4v8,23,AND THIS IS THE WORST BY FAR,-2.6,Negative,test,0
d6hH302o4v8,28,BUT THE LAST HALF HOUR OF THE MOVIE IT FELT LIKE THEY HAD ADDED LIKE A CGI ORGASM,-1.0,Negative,test,0
d6hH302o4v8,29,YOU KNOW THEY JUST TRIED UH WITH THE CGI THAT THEY PUT T T T THEY THEY THREW SO MUCH CGI AT YOU,-1.8,Negative,test,0
d6hH302o4v8,40,DULL,-1.0,Negative,test,0
d6hH302o4v8,41,JUST DONT SEE THIS MOVIE,-2.4,Negative,test,0
d6hH302o4v8,1,THIS MOVIE WAS HORRIBLE,-2.8,Negative,test,0
d6hH302o4v8,3,HES ALWAYS IN THESE KINDS OF MOVIES ALL THIS SORCERER WITCH VOODOO KIND OF MOVIES,0.2,Positive,test,0
d6hH302o4v8,2,NICHOLAS CAGE SHOULD NOT DO THESE KIND OF MOVIES,-1.8,Negative,test,0
d6hH302o4v8,5,HES HORRIBLE AT IT,-1.33333333333,Negative,test,0
d6hH302o4v8,4,AND ITS GETTING REALLY TIRING,-1.6,Negative,test,0
d6hH302o4v8,7,W W W WHEN HES ONSCREEN I WANT TO PUNCH HIM IN THE FACE,-2.8,Negative,test,0
d6hH302o4v8,6,NO ONE TAKES HIM SERIOUSLY,-2.0,Negative,test,0
d6hH302o4v8,9,HE WA HE WAS VERY ANNOYING,-2.4,Negative,test,0
d6hH302o4v8,8,HES VERY BORING,-2.2,Negative,test,0
d6hH302o4v8,39,SEASON OF THE WITCH WAS HORRIBLE ACTING,-3.0,Negative,test,0
d6hH302o4v8,38,DO NOT SEE THIS MOVIE,-3.0,Negative,test,0
d6hH302o4v8,11,AND I WAS SITTING IN THE THEATRE SLEEPING,-1.0,Negative,test,0
d6hH302o4v8,10,HE DIDNT KNOW WHAT HE WAS TALKING ABOUT,-1.2,Negative,test,0
d6hH302o4v8,13,BUT IN THIS MOVIE HE WASNT GOOD AT ALL,-2.0,Negative,test,0
d6hH302o4v8,12,HE WAS VERY GOOD IN HELLBOY,1.4,Positive,test,0
d6hH302o4v8,15,HES VERY BORING AS WELL,-1.75,Negative,test,0
d6hH302o4v8,14,I I I DIDNT REALLY CARE FOR HIS CHARACTER AT ALL,-1.8,Negative,test,0
d6hH302o4v8,17,IT MADE NO SENSE,-2.0,Negative,test,0
d6hH302o4v8,16,WHOLE MOVIES VERY BORING,-2.0,Negative,test,0
d6hH302o4v8,19,I HAD NO IDEA WHY I EVEN SAW THIS MOVIE,-2.8,Negative,test,0
d6hH302o4v8,18,I DIDNT REALLY CARE ABOUT IT AT ALL,-2.0,Negative,test,0
d6hH302o4v8,31,LIKE IT WAS LIKE SPEWING CGI LAST HALF HOUR OF THE MOVIE,-1.4,Negative,test,0
d6hH302o4v8,30,AND IT WAS AWFUL,-2.8,Negative,test,0
d6hH302o4v8,37,AND BORING,-2.2,Negative,test,0
d6hH302o4v8,36,UH HUH HOW ABOUT THE ACTING AND THE ACTION WAS WAS JUST SO DULL,-2.2,Negative,test,0
d6hH302o4v8,35,I WAS SITTING THERE IN THE THEATRE LAUGHING HOW BAD THE MOVIE WAS AT SOME POINTS,-1.6,Negative,test,0
d6hH302o4v8,34,I HATED IT,-3.0,Negative,test,0
d6hH302o4v8,33,IT WAS TERRIBLE,-3.0,Negative,test,0
d6hH302o4v8,32,LIKE EVERY SINGLE SCENE WAS CGI,-0.6,Negative,test,0
dq3Nf_lMPnE,11,AND THEIR PLACE IS A RUN OF THE MILL ANIMATED ACTION ADVENTURE PLOT WITH A FEW CHUCKLES TROWN IN,-0.6,Negative,test,0
dq3Nf_lMPnE,10,AND ALSO THE CUTE WINGS TO POP CULTURE,1.0,Positive,test,0
dq3Nf_lMPnE,13,IF AWARD FOR THE GREAT CHARACTERS OF SHREK IN HIS SUPPORTING CAST THEY ARE STILL VOICED BY THE ORIGINAL STARS MIKE MYERS EDDIE MURPHY CAMERON DIAZ AND ANTONIO BANDERAS THE FILM WOULD BE A REAL BUST,-1.2,Negative,test,0
dq3Nf_lMPnE,12,IT SEEMS LIKE THE WRITERS AND CREATORS TOOK THE EASY WAY OUT,-1.6,Negative,test,0
dq3Nf_lMPnE,15,I GIVE SHREK FOREVER AFTER DIRECTED BY MIKE MITCHELL A GRADE OF B MINUS,1.0,Positive,test,0
dq3Nf_lMPnE,14,UNLESS YOUR KIDS ARE DYING TO SEE IT ID WAIT FOR THE DVD,-1.8,Negative,test,0
dq3Nf_lMPnE,1,XXX WHITNESSING THE CHANGES AND GROWTH OF THE CHARACTERS ITS USAULALY A PATH OF DISCOVERY,0.0,Neutral,test,0
dq3Nf_lMPnE,3,DREAMWORKS IS CONFUSING ME,-1.2,Negative,test,0
dq3Nf_lMPnE,2,THE LAST MINUTE TITLE THAT THEY THREW ON AT THE THEATERS,-1.4,Negative,test,0
dq3Nf_lMPnE,5,EVERYTHING THAT HAPPENED IN SHREK 1 2 AND 3 ARE WIPED AWAY,1.2,Positive,test,0
dq3Nf_lMPnE,4,THEY SOLVED THIS DILEMMA BY REMOVING THE PAST WITHIN ITS A WONDERFUL LIFE TWIST COURTECY OF NEW BETTY RUMPELSTILTSKIN,-0.4,Negative,test,0
dq3Nf_lMPnE,7,BUT ALSO NOT VERY ORIGINAL,-2.0,Negative,test,0
dq3Nf_lMPnE,6,NOT A BAD IDEA FOR A SEQUEL,0.8,Positive,test,0
dq3Nf_lMPnE,9,GONE ARE THE WICKEDLY SATIRICAL STAND UPS OF THE WORLD OF FAIRY TALES,-0.8,Negative,test,0
dq3Nf_lMPnE,8,SHREK 4 MISSES OUT ON THE MAGIC THAT MADE THE FIRST FILM A REAL JOY TO VIEW,0.6,Positive,test,0
etzxEpPuc6I,11,LIKE LIKE EVEN THE ACTORS WERE JUST LIKE YOU KNOW ITS A MOVIE ABOUT A FUCKING TOY,-1.6,Negative,test,0
etzxEpPuc6I,10,THE PLOT IS RIDICULOUS BUT NO ONE TOOK IT SERIOUSLY,-1.4,Negative,test,0
etzxEpPuc6I,13,LIKE THIS ONE PART WHERE THE GIRLS LIKE MY DADDY TAUGHT ME TO WIN WIN AND THEN SHES LOOKING IN THE CAMERA AND IM LIKE WOW LIKE UM THIS ACTINGS PRETTY BAD,-2.2,Negative,test,0
etzxEpPuc6I,12,LAUGHING SO THEYRE JUST SITTING THERE,0.666666666667,Positive,test,0
etzxEpPuc6I,15,LIKE KNOWING IS HALF THE BATTLE,0.2,Positive,test,0
etzxEpPuc6I,14,BUT THE THEY THEY KNEW IT WAS JUST A MOVIE ABOUT A A A A DOLL SO THEY DIDNT TAKE IT SERIOUSLY,-1.2,Negative,test,0
etzxEpPuc6I,17,LIKE IT WAS LIKE THE ACTING WAS TERRIBLE THE ACTION MADE UP FOR IT,-0.4,Negative,test,0
etzxEpPuc6I,16,BUT THE MOVIE WAS WELL IT WAS RIDICULOUSLY TERRIBLE,-2.4,Negative,test,0
etzxEpPuc6I,19,IVE SEEN PEOPLE GET SHOT IN THE EYE YOU KNOW AND THAT WOULD BE IT BUT PEOPLE GETTING SHOT IN THE EYE AND THEN THE THEY HEADS EXPLODE AND THEN SOME DUDE GET HIS TORSO CUT OPEN AND AND SOME DUDES HANGING OUT OF THE CAR HIS HEAD GOT BLOWN OFF AND FREAKING PEOPLE ARE FLYING AND JUMPING,-0.5,Negative,test,0
etzxEpPuc6I,18,THERE WAS PARTS THIS IVE SEEN SOME CREATIVE DEPTHS IN THIS MOVIE IVE NEVER SEEN BEFORE,1.4,Positive,test,0
etzxEpPuc6I,1,UM SO CHANNING TATUM AND MARLON ARE TRANSPORTING IT THEY GET AMBUSHED BY UM I THINK ITS COBRA ITS KINDA HARD TO EXPLAIN IT,0.4,Positive,test,0
etzxEpPuc6I,3,UM FROM THERE IT JUST GOES INTO RIDICULOUSNESS,-1.6,Negative,test,0
etzxEpPuc6I,2,CUZ ITS LIKE THE DUDE THAT MADE THE TECHNOLOGIES I I CANT RUIN THE MOVIE,1.2,Positive,test,0
etzxEpPuc6I,5,I WAS LIKE YOU KNOW THEYRE BOTH HASBRO TOYS THEYRE BOTH MOVES THAT ARE COM MADE FOR CHILDREN,0.0,Neutral,test,0
etzxEpPuc6I,4,THE THING ABOUT THIS MOVIE IS LIKE I I I WANNA COMPARE IT TO TRANSFORMERS 2 AND I ACTUALLY DID,0.8,Positive,test,0
etzxEpPuc6I,7,BUT THE THING ABOUT GI JOE COMPARED TO TRANSFORMERS IS TRANSFOMERS 2 DIDNT KNOW WHAT IT WANTED TO DO,-1.2,Negative,test,0
etzxEpPuc6I,6,BUT THEY HAVE A LOT OF ADULT SITUATIONS IN IT,0.4,Positive,test,0
etzxEpPuc6I,9,AS FOR GI JOE WAS IT WAS JUST LIKE LAUGHING ITS THE THE PLOT THE THE ACTING IS TERRIBLE,-2.8,Negative,test,0
etzxEpPuc6I,8,LIKE IN SOME PARTS YOU HAD PEOPLE GETTING KILLED AND THE NEXT PART YOU HAD FART JOKES AND STUPID FRAT HUMOR AND ALL THAT OTHER CRAP,-1.0,Negative,test,0
f9O3YtZ2VfI,24,BUT ITS ITS LIKE SOMEONE MADE YOU A KICK ASS SANDWICH BUT THEY PUT MAYONNAISE ON IT AND YOU DONT LIKE MAYONNAISE AND ITS NOT LIKE TOMATO OR LETTUCE WHERE YOU CAN PICK IT OFF NO ITS GOT IT MAYONNAISE IN ITS ALL OVER EVERYTHING AND NOW YOURE STUCK WITH THIS KICK ASS SANDWICH THAT WOULD BE KICK ASS IF IT DIDNT HAVE MAYONNAISE ON IT BUT IT HAS MAYONNAISE ON IT OR YOU GO MAKE ANOTHER SANDWICH GO MAKE ANOTHER SANDWICH,-2.6,Negative,test,0
f9O3YtZ2VfI,25,THIS MOVIE IS JUST NOT QUITE GOOD ENOUGH,-1.4,Negative,test,0
f9O3YtZ2VfI,26,I REALLY LIKED DAVID FINCH,1.4,Positive,test,0
f9O3YtZ2VfI,27,I LIKED ALL THE UM I LIKE THE CAST,1.6,Positive,test,0
f9O3YtZ2VfI,20,BUT DONT GET ME WRONG ITS NOT ALL BAD,-0.4,Negative,test,0
f9O3YtZ2VfI,21,ITS GOT MY TWO FAVORITE ACRESSES IN IT TILDA SWINTON AND CATE BLANCHETT,2.0,Positive,test,0
f9O3YtZ2VfI,22,LIKE I SAID BEFORE IS A VERY INTERESTING IDEA,1.4,Positive,test,0
f9O3YtZ2VfI,23,AND THEY DID A LOT OF GOOD THINGS WITH IT,1.6,Positive,test,0
f9O3YtZ2VfI,28,BUT AND ITS A GOOD STORY,1.2,Positive,test,0
f9O3YtZ2VfI,29,BUT CLAP HUH ITS A PASS,-2.0,Negative,test,0
f9O3YtZ2VfI,1,WHAT WHATEVER THE NAME IS TOO LONG,-1.2,Negative,test,0
f9O3YtZ2VfI,3,AND ITS THEY LOOKED LIKE IT HAD A GOOD CORE,0.6,Positive,test,0
f9O3YtZ2VfI,2,ITS A VERY INTERESTING IDEA,1.25,Positive,test,0
f9O3YtZ2VfI,5,THE FIRST PROBLEM IS THAT ITS ALL TOLD IN FLASHBACK FROM A POINT JUST BEFORE KATRINA HITS NEW ORLEANS,-1.8,Negative,test,0
f9O3YtZ2VfI,4,BUT HM IT JUST TOO MANY PROBLEMS WITH IT,-2.4,Negative,test,0
f9O3YtZ2VfI,7,I DONT NEED IT ALL TOLD IN FLASHBACK,-1.2,Negative,test,0
f9O3YtZ2VfI,6,I DIDNT NEED ANY OF THAT CRAP,-2.6,Negative,test,0
f9O3YtZ2VfI,9,IT DOSENT IT JUST ITS TOO MUCH CRAP IN HERE,-2.2,Negative,test,0
f9O3YtZ2VfI,8,I DONT NEED THE ADDED ELEMENT OF KATRINA,-1.8,Negative,test,0
f9O3YtZ2VfI,11,THEY JUST NEED TO CUT THAT OUT,-0.8,Negative,test,0
f9O3YtZ2VfI,10,THE THE MOVIES IS TOO LONG,-2.0,Negative,test,0
f9O3YtZ2VfI,13,TH WE DO NOT NEED THE ENTIRE SPAN BIRTH TO DEATH,-1.6,Negative,test,0
f9O3YtZ2VfI,12,ANOTHER THING IS WE DONT NEED HIS ENTIRE LIFE,-1.8,Negative,test,0
f9O3YtZ2VfI,15,AND SCALE IT DOWN ON LIKE TWO HOURS,-1.2,Negative,test,0
f9O3YtZ2VfI,14,JUST GIVE ME A NICE INTERESTING CHOKE,1.2,Positive,test,0
f9O3YtZ2VfI,17,UM AND IF YOURE GONNA DO MOSTLY CGI JUST MAKE AN ANIMATED MOVIE,-2.0,Negative,test,0
f9O3YtZ2VfI,16,THIS ALSO FALLS IN TO THE TRANDY IS VERY POPULAR THESE DAYS IF YOU DO A WHOLE ALL OF CGI,-1.0,Negative,test,0
f9O3YtZ2VfI,19,MAKES HIM LOOK TOO TOO GOOD,-0.6,Negative,test,0
f9O3YtZ2VfI,18,THIS LOOKS LIKE IT JUST HAS A POLYURETHANE COATING ON IT,-1.0,Negative,test,0
f9O3YtZ2VfI,30,MY NEIGHBOR PROBABLY THINKS IM CRAZY YELLING ABOUT MOVIES TO A CAMERA,-1.0,Negative,test,0
f_pcplsH_V0,11,NOW I DIDNT REALLY LIKE THE FIRST HOUR THAT MUCH THOUGH,-0.4,Negative,test,0
f_pcplsH_V0,10,BUT I THINK THIS ONE DID BEAT SCREAM 2,1.2,Positive,test,0
f_pcplsH_V0,13,I THINK XXX I WANT TO SEE IT,1.6,Positive,test,0
f_pcplsH_V0,12,IM SURE YOU ALL REMEMBER THE STAB MOVIES THAT WERE BASED ON THE SCREAM MOVIES OR THE EXPERIENCES OF SIDNEY IN UNIVERSE SO THAT PEOPLE COULD COMMENT ON THE KILLERS REENACTING THE MOVIES OR FOLLOWING UP THE MOVIES WELL IN THE FIRST HOUR THOSE BECOME WAY WAY WAY TOO MUCH OF A PLOT POINT BASICALLY,-0.8,Negative,test,0
f_pcplsH_V0,15,IM JUST KINDA LIKE NO THIS IS GOING TO FAR,-1.0,Negative,test,0
f_pcplsH_V0,14,BUT IT ACTUALLY BASICALLY MAKES THE CHARACTERS CONGITION NOT JUST OF THE GENRE WITHIN WHICH THEY ARE IN BUT OF THEIR OWN FRANCHISE TO A RIDICULOUS EXTENT,-1.0,Negative,test,0
f_pcplsH_V0,1,SO YOU BETTER APPRECIATE THIS REVIEW,0.25,Positive,test,0
f_pcplsH_V0,3,THEYRE BACK TO YOU HAVING TWO KILLERS THANKFULLY,0.8,Positive,test,0
f_pcplsH_V0,2,BUT TO ANY OF YOU WHO ARE I EXPECT A THUMBS UP,1.4,Positive,test,0
f_pcplsH_V0,5,HMPH MY OVERALL OPINION OF THE RESULTS OF THIS PROCESS ARE ITS BETTER THAN SCREAM 3,1.2,Positive,test,0
f_pcplsH_V0,4,BECAUSE IT DOES MAKE A LOT MORE SENSE HAVING THE KILLER BE ABLE TO BE EVERYWHERE IF THERES TWO OF THEM,0.5,Positive,test,0
f_pcplsH_V0,7,A LOT OF PEOPLE DONT LIKE SCREAM 2,0.0,Neutral,test,0
f_pcplsH_V0,6,AND ACTUALLY IS BETTER THAN SCREAM 2,1.6,Positive,test,0
f_pcplsH_V0,9,I HATED SCREAM 3,-2.4,Negative,test,0
f_pcplsH_V0,8,I THINK ITS HIGHLY UNDERRATED,0.8,Positive,test,0
fvVhgmXxadc,11,AND LATER TIME SHE GOES LIKE A WORLD WAR II BATTLEFIELD UM CASTLE THIS KIND OF PULLED OUT OF LORD OF THE RINGS,-0.2,Negative,test,0
fvVhgmXxadc,10,IN FACT THE FIRST TIME SHE GOES IN IT LOOKS LIKE A JAPANESE TEMPLE,0.0,Neutral,test,0
fvVhgmXxadc,13,ITS KIND OF PLAYING WITH THE IDEA WHATS REAL WHATS NOT WHAT THE MATRIX FILMS DID,0.2,Positive,test,0
fvVhgmXxadc,12,WHATS IN HER MIND WITHIN HER MIND IN A WAY ITS KIND OF LIKE INCEPTION IN THAT WAY,0.0,Neutral,test,0
fvVhgmXxadc,14,ALTHOUGH ACTUALLY THE BEST COMPARISON THIS IS THIS FILM WOULD ACTUALLY BE SOMETHING LIKE PANS LABYRINTH,0.0,Neutral,test,0
fvVhgmXxadc,1,IT ONLY HAD THE POTENTIAL TO BE A FILM THAT WAS BOTH PROVKING AND ACTION PACKED,-0.4,Negative,test,0
fvVhgmXxadc,3,THAT I GOT VERY LITTLE JOY OUT OF,-2.2,Negative,test,0
fvVhgmXxadc,2,BUT UNFORTUNATELY ITS JUST AN UGLY WILD VIOLENT UNVOLVING AND SADISTIC EXERCISE,-2.8,Negative,test,0
fvVhgmXxadc,5,THATS PRETTY HEAVILY INFERRED IN THE OPENING SEQUENCE,0.0,Neutral,test,0
fvVhgmXxadc,4,IN FACT I GOT MOSTLY PAIN OUT OF IT,-2.8,Negative,test,0
fvVhgmXxadc,7,NOW IT ALSO TAKES SO REALLY CREEPY XXXOF THE FACT THAT EMILY BROWNING IN THIS MOVIE LOOKS LIKE SHES UNDERAGE,-1.0,Negative,test,0
fvVhgmXxadc,6,WHEN SHE GETS THERE IS FORCED TO NOT ONLY BE TRAPPED IN THE VOCATION THAT SHE OBVIOUSLY DOESNT WANNA BE IN,-0.2,Negative,test,0
fvVhgmXxadc,9,THAT KIND OF LOOKS LIKE VIDEO GAME IN A CERTAIN WAY,-0.4,Negative,test,0
fvVhgmXxadc,8,BUT I DONT KNOW,-0.5,Negative,test,0
iiK8YX8oH1E,11,SO I WILL GIVE IT POINTS FOR NOT BEING EXACTLY LIKE MY BEST FRIENDS WEDDING EVEN AT THE TRAILER SETS IT UP THAT WAY,1.0,Positive,test,0
iiK8YX8oH1E,10,AND WE SECOND GUESS OURSELVES,0.0,Neutral,test,0
iiK8YX8oH1E,13,BUT I DONT THINK SHES LEADING MATERIAL,-2.0,Negative,test,0
iiK8YX8oH1E,12,GINNIFER GOODWIN IS FUN TO WATCH,1.8,Positive,test,0
iiK8YX8oH1E,15,IF THERE IS ANY SILVERLINING IN THIS MOVIE ITS JOHN KRASINSKI,0.6,Positive,test,0
iiK8YX8oH1E,14,AND LIKE I SAID KATE HUDSON COULDNT BE MORE ANNOYING HERE,-1.2,Negative,test,0
iiK8YX8oH1E,17,BUT HE HAS SOME OF THE FUNNIEST SCENES IN THIS MOVIE,1.6,Positive,test,0
iiK8YX8oH1E,16,WHO I DONT USUALLY LIKE,0.0,Neutral,test,0
iiK8YX8oH1E,18,HE SEEMS TO BE THE ONLY REALISTIC CHARACTER HERE,-1.0,Negative,test,0
iiK8YX8oH1E,1,ITS ONE OF THOSE ROMANTIC COMEDIES THAT WE ALL DREAD,-2.6,Negative,test,0
iiK8YX8oH1E,3,ANNOYINGLY SHE KIND OF YELLS AND SCREAMS THROUGH THE WHOLE MOVIE,-1.25,Negative,test,0
iiK8YX8oH1E,2,NOW THE REAL STAR OF SOMETHING BORROWED IS GINNIFER GOODWIN,1.2,Positive,test,0
iiK8YX8oH1E,5,UM IT KIND OF FOLLOWS THE PATH OF MY BEST FRIENDS WEDDING 1997 JULIA ROBERTS MOVIE EXCEPT IT TAKES THIRTY MINUTES LONGER TO DEVIATE FROM THE SCRIPTS OF MY BEST FRIENDS WEDDING,-0.4,Negative,test,0
iiK8YX8oH1E,4,AND IF YOU CAN TOLERATE HER THE REST OF THE MOVIE ISNT ANY BATTER,-2.0,Negative,test,0
iiK8YX8oH1E,7,BUT MOSTLY ITS JUST KATE HUDSON BEING VERY ANNOYING,-1.6,Negative,test,0
iiK8YX8oH1E,6,THERE ARE SOME FUNNY MOMENTS,0.2,Positive,test,0
iiK8YX8oH1E,9,I THINK WITH WITH THESE KIND OF MOVIES WE KIND OF PREDICT,0.4,Positive,test,0
iiK8YX8oH1E,8,AND I THINK ITS PREDICTABLE UP AN TO A POINT,-1.0,Negative,test,0
jUzDDGyPkXU,24,BUT I KINDA WOULD HAVE READ THAT BEEN LIKE HM I MEAN SCHWARZANEGGER NEVER SAID ANYTHING REALLY THAT BADASS IN HIS MOVIES,-1.0,Negative,test,0
jUzDDGyPkXU,25,BUT ARITE AND MOVING ON THERES NO CHARACTER DEVELOPMENT IN THIS MOVIE NONE,-2.0,Negative,test,0
jUzDDGyPkXU,26,WELL I CAN TELL YOU RIGHT NOW I DONT REMEMBER THE NAMES OF ANY CHARACTERS NONE OF THEM WERE MEMBORABLE,-2.0,Negative,test,0
jUzDDGyPkXU,27,AND THEY WERE ALL JUST REALLY BLAND AND FORGETTABLE,-2.0,Negative,test,0
jUzDDGyPkXU,20,EVERYTHING THEY SAY JUST SOUNDS SO FUCKING STUPID,-2.2,Negative,test,0
jUzDDGyPkXU,21,THE ONLY ACTOR WHO CAN REALLY SELL THEIR LINES IS ERIN ECKART,-1.0,Negative,test,0
jUzDDGyPkXU,22,THERE ARE MOMENTS WHERE HE SAYS SOMETHING YOURE LIKE THAT JUST SOUNDED DUMB AS HELL,-2.4,Negative,test,0
jUzDDGyPkXU,23,BUT HE TOTALLY SELLS IT,1.2,Positive,test,0
jUzDDGyPkXU,1,THE ACTION IS FUCKING AWESOME,2.8,Positive,test,0
jUzDDGyPkXU,3,ITS VERY REMINSCENT OF DISTRICT,0.0,Neutral,test,0
jUzDDGyPkXU,2,THE ACTION IS REALLY REALLY WELL DIRECTED,2.6,Positive,test,0
jUzDDGyPkXU,5,BUT IT DIDNT TURN OUT QUITE NEARLY AS AWESOME AS THAT MOVIE DID,-1.2,Negative,test,0
jUzDDGyPkXU,4,9 ITS LIKE SOMEONE WATCHED THE THIRD ACT OF DISTRICT 9 A BUNCH OF TIMES LIKE LETS MAKE THIS INTO AN ENTIRE MOVIE ITLL BE AWESOME AND THATS PRETTY MUCH WHAT THEY DID HERE,-1.6,Negative,test,0
jUzDDGyPkXU,7,I DIDNT REALLY SEE A COMPARISON TO BLACK HAWK DOWN UNTIL LIKE THE VERY VERY END,-0.6,Negative,test,0
jUzDDGyPkXU,6,IN FACT THIS MOVIE ISNT EVEN ON THE SAME LEVEL AS DISTRICT 9 NOR IS IT UM FOR UH BLACK HAWK DOWN WHICH PEOPLE ARE COMPARING IT TO,-1.6,Negative,test,0
jUzDDGyPkXU,9,THE ALIENS ARE REALLY AWESOME,2.8,Positive,test,0
jUzDDGyPkXU,8,BUT NEVERTHELESS ANOTHER REALLY COOL THING ABOUT THIS MOVIE,1.8,Positive,test,0
jUzDDGyPkXU,11,AND THEY HAVE REALLY COOL TECHNOLOGY THATS REALLY INTERESTING TO WATCH LIKE MAKE THEM BLOW UP SHIT AND YOU KNOW,2.4,Positive,test,0
jUzDDGyPkXU,10,THEY DESIGNED THE ALIENS IN A REALLY COOL UNIQUE WAY TO MAKE THEM LIKE BIOTIC BUT ALSO MECHANICAL,2.4,Positive,test,0
jUzDDGyPkXU,13,BUT ITS NOT ALWAYS QUITE EXPLAINED YOU KNOW LIKE EVERYTHING ABOUT THE ALIENS,-0.6,Negative,test,0
jUzDDGyPkXU,12,AND THEY ALWAYS LIKE PULL OUT SOMETHING NEW,0.5,Positive,test,0
jUzDDGyPkXU,15,LIKE ENOUGH THAT IT ACTUALLY IS A GOOD REASON WHY THEY WHY THEYRE ATTACKING,1.33333333333,Positive,test,0
jUzDDGyPkXU,14,BUT THEY GIVE YOU A GOOD AMOUNT OF INFORMATION ABOUT THEM,0.8,Positive,test,0
jUzDDGyPkXU,17,UH THE DIALOGUE IS TERRIBLE,-2.8,Negative,test,0
jUzDDGyPkXU,16,AND IT KEEPS YOUR INTERESTS IN THE ACTION SCENES AT LEAST DURING THIS MOVIE,1.2,Positive,test,0
jUzDDGyPkXU,19,NOTHING IN THIS MOVIE IS CLEVERLY WRITTEN,2.2,Positive,test,0
jUzDDGyPkXU,18,THERE IS NO GOOD DIALOGUE,-2.4,Negative,test,0
k5Y_838nuGo,24,BUT IT DOES HAVE SOME ADULT HUMOUR,0.6,Positive,test,0
k5Y_838nuGo,25,THOSE ARE QUOTE IN THIS MOVIE THAT SOUNDED SO DIRTY COMING OUT,-0.2,Negative,test,0
k5Y_838nuGo,26,BUT IT AS GREAT,2.0,Positive,test,0
k5Y_838nuGo,27,YES UM SOMETHING ABOUT WAFFLE HOLE AM I THE ONLY ONE AM I PERVERTED NOT TO THINK THAT THAT SOUNDS DIRTY COZ IT TOTALLY DOES WAFFLE HOLE,-0.8,Negative,test,0
k5Y_838nuGo,20,THE THIRD ONE WAS MORE KID HUMOUR THOUGH,0.4,Positive,test,0
k5Y_838nuGo,21,IT DIDNT HAVE THAT MUCH ADULT HUMOUR IN IT,-0.2,Negative,test,0
k5Y_838nuGo,22,UM YEAH THE FOURTH ONE IT DOES HAVE KID HUMOUR DEFINATELLY,0.4,Positive,test,0
k5Y_838nuGo,23,ITS A KIDS MOVIE,-0.2,Negative,test,0
k5Y_838nuGo,28,IT HAD ME LAUGHING OUT LOUD,2.0,Positive,test,0
k5Y_838nuGo,29,AND I DONT THINK THAT MANY OTHER PEOPLE WERE LAUGHING ABOUT IT,-0.75,Negative,test,0
k5Y_838nuGo,1,WHICH I WAS NOT EXCITED TO SEE,-1.6,Negative,test,0
k5Y_838nuGo,3,AND I HAVE TO ADMIT I I LIKE SHREK I DO,0.8,Positive,test,0
k5Y_838nuGo,2,AND IT ACTUALLY SURPRISED ME,1.2,Positive,test,0
k5Y_838nuGo,5,UM THEYVE BECOME QUITE A BIT OVERRATED,-1.33333333333,Negative,test,0
k5Y_838nuGo,4,I LIKE THE FIRST TWO SHREKS QUITE A BIT,1.0,Positive,test,0
k5Y_838nuGo,7,THE THIRD ONE WAS A PIECE OF CRAP,-2.4,Negative,test,0
k5Y_838nuGo,6,BUT THE FIRST TWO WERE PRETTY EXCELLENT,2.0,Positive,test,0
k5Y_838nuGo,9,UM WHICH ACTUALLY WAS REALLY GOOD,1.8,Positive,test,0
k5Y_838nuGo,8,AND THATS WHY I WAS NOT EXCITED ABOUT THE FOURTH ONE,-1.4,Negative,test,0
k5Y_838nuGo,11,UM I I DID ENJOY IT,0.5,Positive,test,0
k5Y_838nuGo,10,I DID LIKE THE FOURTH ONE QUITE A BIT,2.0,Positive,test,0
k5Y_838nuGo,13,AND IT JUST WAS BETTER,0.6,Positive,test,0
k5Y_838nuGo,12,IT REMINDED ME OF THE FIRST ONE HAD THE SAME KIND OF VIBE LIKE THE FIRST ONE,0.2,Positive,test,0
k5Y_838nuGo,15,COZ THE FIRST TWO WERE GREAT AND THEY BROUGHT IN THE KIDS AND IT MADE IT MORE KIDDY FRIENDLY MOVIE,-0.8,Negative,test,0
k5Y_838nuGo,14,MAYBE ITS THE BABY OGRES MAYBE BRINGING IN THE BABY OGRES REALLY BROUGHT IT DOWN,-1.8,Negative,test,0
k5Y_838nuGo,17,BUT THEY WERE HAD ADULT HUMOUR,0.8,Positive,test,0
k5Y_838nuGo,16,THE FIRST TWO WERE KID MOVIES,0.25,Positive,test,0
k5Y_838nuGo,19,AND WOULD GO OVER THE KIDS HEADS AND THIS IS WHAT THE FOURTH ONE KIND OF HAS,-0.6,Negative,test,0
k5Y_838nuGo,18,I THOUGH THAT ADULTS WOULD APPRECIATE,0.4,Positive,test,0
k5Y_838nuGo,31,BECAUSE MY ONE OF MY COUSINS DOESNT LIKE THE GLASSES,-1.0,Negative,test,0
k5Y_838nuGo,30,UM YEAH ITS ITS BETTER THAN THE THIRD ONE ABSOLUTELY,1.6,Positive,test,0
lXPQBPVc5Cw,24,LIKE I DONT UNDERSTAND,-1.4,Negative,test,0
lXPQBPVc5Cw,25,LIKE I I ACTUALLY FELT MYSELF CHECKING THE TIME CUZ I WAS LIKE WHEN IS THIS MOVIE GOING TO END,-2.4,Negative,test,0
lXPQBPVc5Cw,26,I DO NOT WANNA SEE ANY MORE OF THIS,-2.8,Negative,test,0
lXPQBPVc5Cw,27,AND I TELL I COULDNT GET OUT OF THAT MOVIE THEATRE FAST ENOUGH,-2.8,Negative,test,0
lXPQBPVc5Cw,20,UM YEAH SO WE WERE OUT FOR MOST OF IT WE WERE TALKING ABOUT I WAS TEXTING I JUST LIKE I HAD ABSOLUTELY THE FILM HAD NO DRAW TO ME,-1.8,Negative,test,0
lXPQBPVc5Cw,21,THE BEGINNING STARTED OFF GREAT WITH A COUPLE GOOD JOKES,1.8,Positive,test,0
lXPQBPVc5Cw,22,AND REALLY FUNNY UH ANIMATION STUFF IT WAS GREAT REALLY FUNNY,2.6,Positive,test,0
lXPQBPVc5Cw,23,UM AND THEN TOWARDS THE MIDDLE IT WAS LIKE WHAT IS GOING ON,-2.4,Negative,test,0
lXPQBPVc5Cw,28,UM IN GENERAL UM THE LITTLE KIDS SEEMED TO LIKE IT THAT WERE IN THERE,0.8,Positive,test,0
lXPQBPVc5Cw,29,BUT THE ADULTS WERE THE ADULTS THAT WERE ACTUALLY ATTEMPTING TO WATCH IT AND THE PEOPLE WHO WERE MY AGE AS WELL WERE LIKE WHAT DID I JUST SEE,-1.2,Negative,test,0
lXPQBPVc5Cw,1,YES WHEN YOU HEAR JOHNNY DEPP YOU THINK UH THIS MOVIE HAS TO BE GOOD,0.2,Positive,test,0
lXPQBPVc5Cw,3,IT WAS REALLY BORING TO ME,-2.4,Negative,test,0
lXPQBPVc5Cw,2,IM NOT GOING TO LIE TO YOU IT WASNT GOOD,-2.2,Negative,test,0
lXPQBPVc5Cw,5,I GO FOR LIKE THE MORE OLDIES TYPE TYPE FILMS I GUESS LIKE THE OLDER PIXAR FILMS LIKE TOY STORY AND ALL THAT STUFF,-1.0,Negative,test,0
lXPQBPVc5Cw,4,CHUCKLING I MEAN AND I DONT ACTUALLY GO AND IM NOT BEING BIASED BECAUSE I DONT REALLY GO FOR THE ANIMATED TYPE FILMS,-1.2,Negative,test,0
lXPQBPVc5Cw,7,LAUGHING YOU KNOW A MOVIES TERRIBLE WHEN A PERSON TRYING TO REVIEW IT DOESNT EVEN KNOW WHAT TO SAY BUT I DONT KNOW THIS MOVIE WAS,-2.8,Negative,test,0
lXPQBPVc5Cw,6,UM BUT THIS ONE WAS UH I DONT KNOW I MEAN THE STORY WAS THERE BUT SIGH I DONT KNOW,-1.4,Negative,test,0
lXPQBPVc5Cw,9,BUT IT WAS JUST IT WAS LIKE IM NOT GONNA EVEN LIE TO YOU GUYS I FELL ASLEEP AROUND THE MIDDLE OF IT AND WOKE UP LIKE WHAT JUST HAPPENED,-2.6,Negative,test,0
lXPQBPVc5Cw,8,UH JOHNNY DEPP DOING THE VOICE WAS FANTASTIC,2.6,Positive,test,0
lXPQBPVc5Cw,11,IT WASNT THERE,-1.8,Negative,test,0
lXPQBPVc5Cw,10,UM ITS ONE OF THOSE MOVIES WHERE MOST OF THE FUNNY PARTS ARE IN THE COMMERCIAL YOU KNOW YOUVE SEEN THE COMMERCIAL SO MANY TIMES THAT THAT PART ISNT EVEN FUNNY ANYMORE AND THEN YOURE WONDERING WHERE THE HELL IS THE REST OF IT,-2.2,Negative,test,0
lXPQBPVc5Cw,13,THE VOICE ACTING WAS PHENOMENAL,2.8,Positive,test,0
lXPQBPVc5Cw,12,IT JUST WASNT IT DI DID NOT WORK FOR ME,-2.0,Negative,test,0
lXPQBPVc5Cw,15,IT WAS SO BAD I JUST DID NOT ENJOY IT,-2.8,Negative,test,0
lXPQBPVc5Cw,14,BUT THE THE ACTUAL STORY LINE WAS JUST TERRIBLE,-2.2,Negative,test,0
lXPQBPVc5Cw,17,IM NOT EVEN KIDDING I WENT WITH A BUNCH OF FRIENDS AND A MOVIES SUPPOSED TO BE TEN TIMES BETTER WHEN YOURE WITH A BUNCH OF FRIENDS,-1.8,Negative,test,0
lXPQBPVc5Cw,16,UH I WILL I WILL ACTUALLY SAY THIS RIGHT NOW IT WAS A GOOD WASTE OF LIKE 12,0.2,Positive,test,0
